{
  "claimBoundary": "Reliability, parity, provenance, and security hardening only. Accuracy, generalization, effort reduction, benchmark superiority, and clinical performance are not established.",
  "controlledChecks": {
    "claim": "Local evidence only; no empirical performance claim.",
    "entryPoint": "scripts/verify-controlled.ps1",
    "evidence": "Recorded local controlled-data validation; clone-safe checks verify the lock and schemas without requiring ignored evidence files.",
    "exp005SafeLabels": 0,
    "exp012Status": "NOT YET COMPUTABLE",
    "m4b1ClassificationChanges": 0,
    "status": "PASS"
  },
  "packageTreePaths": [
    "VEGO-AI-Thesis-Baseline-Progress.html",
    "docs/research/h-layer/program-status-snapshot-v1.json",
    "docs/research/hardening/baseline-lock-manifest-v2.json",
    "docs/research/hardening/iteration-015-manifest.json",
    "docs/research/hardening/sbom.cdx.json",
    "docs/research/hardening/security-posture-snapshot-v1.json"
  ],
  "packageTreeSha256": "a67cc0e2efef7a5fa25c6696b03eaccf6e13cc5204debb0bf23e46f2a395eeb6",
  "releaseId": "unified-runtime-security-hardening-v1",
  "sbom": {
    "format": "CycloneDX-1.5",
    "path": "docs/research/hardening/sbom.cdx.json",
    "sha256": "9e26667891c31211a285c14fb5970353174d263b23e8b7112fe232f6f9b97d43"
  },
  "schemaVersion": "ReleaseManifest-v3",
  "sourceChecks": {
    "claim": "Clone-safe contracts, tests, lint, security, and browser checks.",
    "entryPoint": "scripts/verify-source.ps1",
    "status": "PASS"
  },
  "sourceTreePaths": [
    ".gitattributes",
    ".github/workflows/security-weekly.yml",
    ".github/workflows/supervisor-package.yml",
    ".gitignore",
    "VEGO-AI/eval/README_EVALUATOR.md",
    "VEGO-AI/framework/README.md",
    "VEGO-AI/framework/hlayer_architecture.py",
    "VEGO-AI/framework/human_feedback_manager.py",
    "VEGO-AI/framework/human_judgment_memory.py",
    "VEGO-AI/framework/human_review_queue.py",
    "VEGO-AI/framework/llm_client.py",
    "VEGO-AI/framework/memory_advisor.py",
    "VEGO-AI/framework/memory_informed_classifier.py",
    "VEGO-AI/framework/requirements.txt",
    "VEGO-AI/schemas/memory_informed_comparison.schema.json",
    "VEGO-AI/tests/test_accuracy_improvement_analysis.py",
    "VEGO-AI/tests/test_human_feedback_manager.py",
    "VEGO-AI/tests/test_human_judgment_memory.py",
    "VEGO-AI/tests/test_human_review_queue.py",
    "VEGO-AI/tests/test_llm_client_security.py",
    "VEGO-AI/tests/test_memory_advisor.py",
    "VEGO-AI/tests/test_memory_informed_classifier.py",
    "VEGO-AI/tests/test_results_dashboard.py",
    "VEGO-AI/tests/test_visualizer_helpers.py",
    "VEGO-AI/vego_visualizer_delivery/visualizer_utils.py",
    "configs/README.md",
    "configs/hlayer-runtime.json",
    "configs/protected-change-authorization-v1.json",
    "package-lock.json",
    "package.json",
    "pyproject.toml",
    "requirements-dev.txt",
    "requirements-thesis.txt",
    "schemas/architecture-run-manifest-v1.schema.json",
    "schemas/baseline-lock-manifest-v2.schema.json",
    "schemas/evaluation-run-manifest-v2.schema.json",
    "schemas/examples/architecture-run.valid.json",
    "schemas/examples/evaluation-pilot.valid.json",
    "schemas/examples/evaluation-zero-label.valid.json",
    "schemas/examples/gold-label-adjudicated.valid.json",
    "schemas/examples/gold-label-raw.valid.json",
    "schemas/examples/model-execution.valid.json",
    "schemas/examples/policy-baseline-mutation.invalid.json",
    "schemas/examples/policy-frozen.valid.json",
    "schemas/gold-label-record-v2.schema.json",
    "schemas/hlayer-iteration-manifest-v1.schema.json",
    "schemas/hlayer-runtime-config-v1.schema.json",
    "schemas/model-execution-manifest-v1.schema.json",
    "schemas/policy-candidate-record-v1.schema.json",
    "schemas/release-manifest-v3.schema.json",
    "schemas/security-posture-snapshot-v1.schema.json",
    "schemas/thesis-evidence-snapshot-v1.schema.json",
    "schemas/thesis-review-package-manifest-v1.schema.json",
    "scripts/build-hlayer-experiments.ps1",
    "scripts/build_hardening_manifests.py",
    "scripts/check_dependency_lock.py",
    "scripts/check_evidence_consistency.py",
    "scripts/check_hlayer_change_authorization.py",
    "scripts/check_quality_ratchet.py",
    "scripts/run_hlayer_architecture.py",
    "scripts/security_audit.py",
    "scripts/tests/fixtures/exp009_seeds.v1.json",
    "scripts/tests/fixtures/failing_evidence_guard.py",
    "scripts/tests/fixtures/pass_then_fail_protected_guard.py",
    "scripts/tests/supervisor_package_browser_smoke.mjs",
    "scripts/tests/test_build_hlayer_decision_snapshot.py",
    "scripts/tests/test_build_hlayer_program_overview.py",
    "scripts/tests/test_build_progress_tracker.py",
    "scripts/tests/test_change_authorization.py",
    "scripts/tests/test_dependency_lock.py",
    "scripts/tests/test_feedback_generalizer.py",
    "scripts/tests/test_hardening_manifests.py",
    "scripts/tests/test_hlayer_architecture_cli.py",
    "scripts/tests/test_hlayer_hardening.py",
    "scripts/tests/test_security_audit.py",
    "scripts/tests/test_thesis_evidence_package.py",
    "scripts/tests/test_validate_hlayer_program_portability.py",
    "scripts/tests/thesis_progress_browser_smoke.mjs",
    "scripts/vego_doctor.py",
    "scripts/verify-controlled.ps1",
    "scripts/verify-release.ps1",
    "scripts/verify-source.ps1",
    "scripts/verify_hlayer_controlled_parity.py",
    "src/vego_hlayer/__init__.py",
    "src/vego_hlayer/adapters.py",
    "src/vego_hlayer/contracts.py",
    "src/vego_hlayer/io_safety.py",
    "src/vego_hlayer/runtime.py",
    "src/vego_hlayer/state_machine.py",
    "tests/hlayer_offline/conftest.py",
    "tests/hlayer_offline/test_contracts_and_state.py",
    "tests/hlayer_offline/test_experiments.py",
    "tests/hlayer_offline/test_io_safety.py",
    "tests/hlayer_offline/test_suite.py",
    "tests/hlayer_offline/test_unified_runtime.py",
    "tests/hlayer_offline/test_validator.py",
    "uv.lock"
  ],
  "sourceTreeSha256": "63766ff61fe6a799dc6afa334310e63cf5e86735fb35a1eab67757d604d198c0",
  "toolVersions": {
    "jsonschema": "4.26.0",
    "openai": "1.109.1",
    "pytest": "9.0.3",
    "python": ">=3.10",
    "ruff": "0.15.16"
  },
  "trackedArtifacts": {
    "VEGO-AI-Thesis-Baseline-Progress.html": "304f7a10f729ff44ea27d6b593c878dc858494cd7e03c6b21c223046971a8b5e",
    "docs/research/h-layer/program-status-snapshot-v1.json": "18566ce721da0f6a96a12438997f31f3d1b0e301fef64dc9909a778676e82c7c",
    "docs/research/hardening/baseline-lock-manifest-v2.json": "3ed664b6de6b8d943e36493bbb8e31d863e8a3dea041cfda82c7be5e218d695f",
    "docs/research/hardening/iteration-015-manifest.json": "85912d0ae237270284d06ce0acf2bead7ba5f6db0705a9c549a459cd9cdd1550",
    "docs/research/hardening/sbom.cdx.json": "9e26667891c31211a285c14fb5970353174d263b23e8b7112fe232f6f9b97d43",
    "docs/research/hardening/security-posture-snapshot-v1.json": "de37819083ac9cd814cf0ad3b0b0028b50fa9671d024e8b97c422fcf3a49e4cd"
  }
}
